Category,Platform Name,Official Website,Referral Link,Notes,Status,Description,Features,Logo,capsules,favicon,status,lastUpdated,currentDeals
DeFi,Cetus,https://www.cetus.zone,,,Existing,"Cetus is a leading decentralized exchange (DEX) and concentrated liquidity protocol built on Aptos and Sui. It offers advanced features like Infinity Pools, Intent Trading for advanced order types, and an Asset Launchpad, aiming to provide a seamless and capital-efficient trading experience within Move-based ecosystems.","Aptos and Sui DEX.Concentrated Infinity Pools.Advanced Intent Trading,Asset Launchpad,Capital-efficient trading.",logo_Cetus.png,"Aptos,Sui",fav_Cetus.png,,2025-06-22T15:31:16.440Z,Check platform for offers
DeFi,Suilend,https://suilend.fi,,,Existing,"Suilend is a decentralized lending and borrowing protocol built on the Sui blockchain. It aims to provide secure and efficient money markets for users within the Sui ecosystem, enabling overcollateralized loans and interest-earning opportunities for deposited assets.","Sui lending,Borrowing platform,Money markets,Overcollateralized loans,Interest earnings.",logo_Suilend.png,"Sui,Lending",fav_Suilend.png,,2025-06-22T15:31:16.941Z,Check platform for offers
DeFi,carv,https://carv.io,,,Existing,"CARV is an AI agentic infrastructure and Web3 gaming identity platform on the SVM Chain, extending to Ethereum for enhanced security. It empowers AI agents with data sovereignty to build user-centric gaming experiences and advance AI capabilities.",Web3 gaming identity. AI agentic infrastructure. Extends SVM to Ethereum. Empowers AI agents. Focuses data sovereignty.,logo_carv.png,"Gaming,AI Agents,SVM Chain",fav_carv.png,,2025-06-22T15:31:17.449Z,Check platform for offers
DeFi,Ether.fi,https://www.ether.fi/,,,Existing,"ether.fi is a leading liquid restaking protocol on Ethereum, providing institutional and retail users with enhanced capital efficiency for their staked ETH. Users retain control of their keys while earning staking rewards, and can utilize their eETH liquid restaking token across DeFi. They also offer a non-custodial crypto corporate card.","Ethereum liquid restaking,eETH token,Capital efficiency,DeFi composability,Staking rewards,Institutional staking,Corporate crypto card",logo_aeitheir.png,"Restaking,Ethereum,corporate car",fav_aeitheir.png,,2025-06-22T15:31:17.951Z,Check platform for offers
DeFi,parcl,https://parcl.co,,,Existing,"Parcl is a decentralized real estate trading platform built on the Solana blockchain. It allows users to trade perpetual futures on the price movements of real-world real estate markets, aiming to provide liquid and accessible exposure to real estate without needing to own physical property.","Real estate futures,Solana platform,Perpetual trading,Liquid markets,Digital property.",logo_parcl.png,"RealEstate,Solana,Futures",fav_parcl.png,,2025-06-22T15:31:18.455Z,Check platform for offers
DeFi,assetdash,https://assetdash.com,https://bit.ly/3dNXbSJ,,Existing,"AssetDash is a cross-chain portfolio tracker and social platform for Web3 assets. It allows users to track their crypto, NFTs, stocks, and other digital assets in one place, connect with friends, and discover new projects, aiming to provide an overview of their digital wealth.","Cross-chain portfolio tracking,NFT tracking,Social features,Digital asset data aggregator",logo_assetdash.png,"Portfolio tracking,Analytics",fav_assetdash.png,,2025-06-22T15:31:18.969Z,Referral link available
DeFi,sharkyfi,https://sharky.fi,,,Existing,"Sharky.fi is a decentralized lending protocol on the Solana blockchain specializing in NFT collateralized loans. It allows users to borrow against their NFTs or lend capital to earn yield, aiming to unlock liquidity for digital collectibles within the Solana ecosystem.","NFT lending and Borrowing protocol,Solana NFTs,Digital collectibles,Liquidity unlock",logo_sharkyfi.png,"NFTs,Lending,Solana",fav_sharkyfi.png,,2025-06-22T15:31:19.483Z,Check platform for offers
Marketplace,Opensea,https://opensea.io,,,Existing,"OpenSea is the world's largest peer-to-peer marketplace for NFTs (Non-Fungible Tokens). It allows users to buy, sell, and discover various digital collectibles, including art, gaming items, music, and virtual world assets, across multiple blockchains.","Leading NFT marketplace,Wide range of Digital collectibles,Buy Sell and Discover NFTs,Multi-chain support.",logo_Opensea.png,"NFTs,Collectibles",fav_Opensea.png,,2025-06-22T15:31:19.985Z,Check platform for offers
Marketplace,Blur,https://blur.io,,,Existing,"Blur is a leading NFT marketplace and aggregator designed specifically for professional NFT traders. It offers advanced trading tools, real-time data, and a fast, low-fee bidding experience, aiming to provide a superior trading environment for high-volume NFT users.","NFT marketplace,Ideal for Professional traders,Advanced tools,Real-time data,Low fees.",logo_Blur.png,"NFTs,Art,Collectibles",fav_Blur.png,,2025-06-22T15:31:20.487Z,Check platform for offers
Marketplace,Magiceden,https://magiceden.io,,,Existing,"Magic Eden is a leading cross-chain NFT marketplace, initially prominent on Solana and now supporting other chains like Ethereum, Polygon, and Bitcoin Ordinals. It provides a platform for discovering, buying, selling, and minting NFTs, emphasizing a user-friendly experience and broad collection support.","Cross-chain marketplace,NFT discovery/trading,Supports multiple blockchains,User-friendly interface,NFT minting platform.",logo_Magiceden.png,"NFT minting,Collectibles,Art",fav_Magiceden.png,,2025-06-22T15:31:20.988Z,Check platform for offers
Marketplace,Sniper xyz,https://sniper.xyz,,,Existing,"Sniper.xyz, previously a well-know NFT marketplace has evolved into a high-speed trading terminal and wallet tracker on Solana, specializing in fast token execution and meme coin analysis. It offers advanced bot-like functionalities and a ""memescope"" for discovering new opportunities within the Solana token ecosystem.","Solana trading terminal,Fast token execution,Wallet tracking tools,Meme coin analysis,Advanced bot features.",logo_Sniper_xyz.png,"Solana,Wallet tracker,Memecoins",fav_Sniper_xyz.png,,2025-06-22T15:31:21.501Z,Check platform for offers
Marketplace,Tensor,https://www.tensor.trade,,,Existing,"Tensor.trade is a leading NFT marketplace aggregator specifically built for Solana. It provides advanced trading tools, real-time data, and a robust platform for professional NFT traders, aiming to offer the deepest liquidity and best prices across Solana NFTs.","Solana NFT aggregator,Professional trading tools,Real-time NFT data,Deep liquidity,Low fee bidding.",logo_Tensor.png,"NFTs,Solana",fav_Tensor.png,,2025-06-22T15:31:22.003Z,Check platform for offers
Marketplace,Opensea pro,https://pro.opensea.io,,,Existing,"OpenSea Pro (formerly Gem) is an advanced NFT marketplace aggregator that pulls listings from over 170 marketplaces. Designed for professional NFT traders, it offers tools for bulk buying, rarity filtering, and real-time insights, aiming to optimize the NFT trading experience.","NFT marketplace aggregator,Bulk purchasing,Rarity filtering,Real-time insights,Professional tools.",logo_Opensea_pro.png,NFT Aggregator,fav_Opensea_pro.png,,2025-06-22T15:31:22.505Z,Check platform for offers
Marketplace,Whalesmarket,https://pro.whales.market/,https://pro.whales.market/?r=935784,,Existing,"WhalesMarket is an OTC (Over-The-Counter) trading platform for pre-market and pre-TGE (Token Generation Event) tokens. It facilitates secure trading of unlaunched tokens via escrow services and smart contracts, aiming to provide early access to new projects.","OTC trading,Pre-market tokens,Pre-TGE access,Escrow services,Smart contract security.",logo_Whalesmarket.png,"Pre-market,Escrow",fav_Whalesmarket.png,,2025-06-22T15:31:23.016Z,Referral link available
Marketplace,Rairable,https://rarible.com,,,Existing,"Rarible is a multi-chain NFT marketplace that allows creators and collectors to buy, sell, and mint NFTs across various blockchains like Ethereum, Flow, and Polygon. It emphasizes community governance and provides tools for artists to create and showcase their digital assets.","Multi-chain NFTs,Creator platform,Community governance,Buy/sell digital art,NFT minting.",logo_Rairable.png,"NFT minting,Multi-chain",fav_Rairable.png,,2025-06-22T15:31:23.529Z,Check platform for offers
Marketplace,Launchmynft,https://launchmynft.io,,,Existing,"LaunchMyNFT is a comprehensive platform designed to simplify the process of launching NFT collections without needing to write code. It provides tools for minting, managing, and marketing NFT projects across various blockchains.","No-code NFT launchpad,Collection minting,NFT project management,Marketing tools,Creator friendly.",logo_Launchmynft.png,"NFT minting,Launchpad",fav_Launchmynft.png,,2025-06-22T15:31:24.034Z,Check platform for offers
Marketplace,Unisat,https://unisat.io,,,Existing,"UniSat is a leading open-source Chrome extension wallet and platform for the Bitcoin ecosystem, specifically supporting Ordinals and BRC-20 tokens. Beyond secure storage and inscription, it now offers a comprehensive NFT marketplace, a BRC-20 swap/trading platform, and a dedicated block explorer (Uniscan) for transaction tracking supporting a growing ecosystem of Bitcoin-native assets.","Bitcoin Ordinals,BRC-20 wallet,Open-source,Token inscription,Bitcoin ecosystem,NFT marketplace,BRC-20 trading,Uniscan TX tracking.",logo_Unisat.png,"Bitcoin,Ordinals",fav_Unisat.png,,2025-06-22T15:31:24.549Z,Check platform for offers
Marketplace,TokenTrove,https://tokentrove.com,,,Existing,"TokenTrove is an NFT marketplace focused on gaming and digital collectibles, particularly for Immutable X. It offers a fast, gas-free trading experience for in-game assets and NFTs, aiming to provide a seamless environment for web3 gaming communities.","Gaming NFT marketplace,Immutable X,Gas-free trading,In-game assets,Digital collectibles.",logo_TokenTrove.png,"Gaming NFTs,ImmutableX",fav_TokenTrove.png,,2025-06-22T15:31:25.050Z,Check platform for offers
Marketplace,Polymarket,https://polymarket.com,,,Existing,"Polymarket is a decentralized prediction market platform that allows users to bet on real-world events. It combines information aggregation with financial incentives, enabling users to trade on the outcome of future events ranging from politics to sports and pop culture.","Decentralized prediction markets,Real-world events,Information aggregation,Financial incentives,Outcome trading.",logo_Polymarket.png,"Prediction Markets,Betting",fav_Polymarket.png,,2025-06-22T15:31:25.564Z,Check platform for offers
Marketplace,zetamarkets,https://zeta.markets,,,Existing,"Zeta Markets is a decentralized derivatives exchange built on Solana. It offers liquid futures and options trading for crypto assets, focusing on high performance, low latency, and a capital-efficient trading experience for both retail and institutional users.","Solana derivatives,Futures/options,Low latency,Capital efficiency,Professional trading.",logo_zetamarkets.png,"Solana,Futures,Options",fav_zetamarkets.png,,2025-06-22T15:31:26.068Z,Check platform for offers
Marketplace,element,https://element.market,,,Existing,"Element.market is a multi-chain NFT marketplace and aggregator. It allows users to trade NFTs across various blockchains like Ethereum, BNB Chain, and Polygon, providing features for bulk listing, rarity filtering, and gas-free trading, aiming for an efficient NFT experience.","Multi-chain NFT,Marketplace aggregator,Bulk listing,Gas-free trading,Rarity filtering.",logo_element.png,"NFTs,Multi-chain",fav_element.png,,2025-06-22T15:31:26.569Z,Check platform for offers
Marketplace,scatterart,https://www.scatter.art/,,,Existing,"Scatter.art is an NFT marketplace focused on generative art collections. It provides a platform for artists to mint and sell generative art, emphasizing on-chain provenance and unique artistic expression, aiming to foster the creation and appreciation of algorithmic art.","Generative art NFTs,NFT marketplace,On-chain provenance,Artistic expression,Algorithmic art.",logo_scatterart.png,"NFTs,Generative Art",fav_scatterart.png,,2025-06-22T15:31:27.075Z,Check platform for offers
Marketplace,zkmarkets,https://www.zkmarkets.com/,,,Existing,"zkMarkets is a decentralized NFT marketplace built on the zkSync Era network. It aims to provide a fast, low-cost, and user-friendly platform for buying, selling, and discovering NFTs within the zkSync ecosystem, leveraging the benefits of ZK-rollup technology.","zkSync Era NFTs,Decentralized marketplace,Fast transactions,Low gas fees,User-friendly platform.",logo_zkmarkets.png,"NFTs,zkSync,Layer2",fav_zkmarkets.png,,2025-06-22T15:31:27.578Z,Check platform for offers
Marketplace,topaz,https://topaz.so,,,Existing,,,,,,,2025-06-22T15:31:28.080Z,Check platform for offers
Marketplace,supersweep,https://supersweep.io,,,Existing,,,,,,,2025-06-22T15:31:28.581Z,Check platform for offers
Trading Bots/Platforms,Photon,https://photon-sol.tinyastro.io,https://photon-sol.tinyastro.io/@d3x7,,Existing,"Photon is a high-performance, multi-chain trading terminal and decentralized exchange (DEX) aggregator. Initially on Solana, it now supports Ethereum, BNB, Blast, Tron and Base. It provides lightning-fast execution, advanced order types, real-time charting, and a comprehensive suite of tools for professional traders seeking efficiency and precision across various ecosystems.","Solana trading terminal,DEX aggregator,Lightning-fast execution,Advanced order types,Real-time charting.",logo_Photon.png,"Solana,web-based",fav_Photon.png,,2025-06-22T15:31:29.095Z,Referral link available
Trading Bots/Platforms,Bullx,https://bullx.io,https://t.me/BullxBetaBot?start=access_F99J7T8ORT,,Existing,"BullX is a high-performance decentralized trading terminal and DEX aggregator that operates across multiple blockchains, including Solana, Ethereum, Arbitrum, BNB Chain, and Blast. It provides fast execution, real-time data, and a suite of advanced tools for professional traders seeking efficient and precise trading across various ecosystems.","Solana trading terminal,Fast order execution,Real-time data,DEX aggregation,Advanced trading tools,Multi-chain support:SOL BNB Arbitrum Blast Eth and Base",logo_Bullx.png,"Multi-chain,Web-based bot",fav_Bullx.png,,2025-06-22T15:31:29.597Z,Referral link available
Trading Bots/Platforms,Bullx Neo,https://neo.bullx.io,https://t.me/BullXNeoBot?start=access_Z7EJ8X3UOB,,,"BullX Neo is the next-generation trading terminal from BullX, designed as a cross-chain platform for advanced traders. While still emphasizing speed and precision, it introduces more sophisticated features like wallet tracking and automated selling, DCA orders, deeper analytics, and multi-chain support (initially Solana, expanding to others like Ethereum, Tron, BNB, L2s)","Next-gen trading,Cross-chain support,Enhanced charting,Deeper analytics,Advanced order types,Fast Execution",logo_Bullx_Neo.png,"Multi-chain,Web-based",fav_Bullx_Neo.png,,2025-06-22T15:31:30.097Z,Referral link available
Trading Bots/Platforms,Axiom,https://axiom.trade,https://axiom.trade/@d3x7,,Existing,"Axiom is a decentralized perpetual exchange that focuses on providing a secure and capital-efficient trading experience. It aims to offer deep liquidity and high leverage across various crypto assets, leveraging advanced trading mechanisms for decentralized derivatives.","Decentralized perpetuals,Capital efficient trading,Deep liquidity pools,High leverage options,Secure derivative markets.",logo_Axiom.png,"Perpetuals,Derivatives",fav_Axiom.png,,2025-06-22T15:31:30.609Z,Referral link available
Trading Bots/Platforms,GMGN,https://gmgn.ai/,https://gmgn.ai/?ref=c0chR98s,,,"GMGN.ai is a Web3 trading platform leveraging AI to provide a suite of tools for crypto enthusiasts, including analytics, wallet tracking, and trend identification. It aims to help users make informed decisions in the fast-paced decentralized finance and NFT markets.","AI-powered analytics,Web3 data insights,Wallet tracking,Trend identification,Market analysis tools.",logo_GMGN.png,"AI,Analytics",fav_GMGN.png,,2025-06-22T15:31:31.113Z,Referral link available
Trading Bots/Platforms,Unibot,https://unibot.app,https://unibot.app/x?ref=d3x7,,,"Unibot is a popular Telegram trading bot designed for lightning-fast token swaps on Ethereum and other EVM chains. It offers advanced features like limit orders, copy trading, and private transaction routing, aiming to provide a competitive edge for retail traders.","Telegram trading bot,Fast token swaps,Limit order functionality,Copy trading support,Private transaction routing.",logo_Unibot.png,"Advanced bot,Ethereum",fav_Unibot.png,,2025-06-22T15:31:31.624Z,Referral link available
TG Trading Bots,Trojan,https://t.me/trojanbot,https://t.me/solana_trojanbot?start=r-dextrorsal,,Existing,Trojan on Solana is a prominent Telegram trading bot that allows users to execute lightning-fast token swaps and manage their positions directly within Telegram. It offers advanced features like anti-rug protection and sniper capabilities for new token launches.,"Solana trading bot,Fast token swaps,Telegram interface,Anti-rug protection,Sniper capabilities.",logo_Trojan.png,"Sniper,Anti-rug",fav_Trojan.png,,2025-06-22T15:31:32.126Z,Referral link available
TG Trading Bots,SOL trading,https://t.me/soltrading_bot,https://t.me/SolanaTradingBot?start=d5xD6OsVl,,Existing,"SOL Trading Bot is a comprehensive Telegram-based trading tool designed for lightning-fast and efficient token trading on the Solana blockchain. It provides users with rapid execution for swaps, liquidity management, sniping capabilities for new launches, and advanced order types, aiming to optimize trading strategies directly from the Telegram app.","Solana trading bot,Rapid swap execution,Liquidity management,Telegram interface,Trading strategy.",logo_SOL_trading.png,"Solana,Sniper bot",fav_SOL_trading.png,,2025-06-22T15:31:32.640Z,Referral link available
TG Trading Bots,Maestro,https://t.me/MaestroSniperBot,https://t.me/maestro?start=r-dextrorsal,,Existing,"Maestro is a highly popular and advanced Telegram trading bot that operates across multiple EVM chains, including Ethereum and Arbitrum. It offers ultra-fast token swaps, sniper bot functionalities for new launches, limit orders, and comprehensive wallet tracking, catering to professional traders.","Multi-chain trading,Ultra-fast swaps,Sniper bot features,Limit order support,Wallet tracking.",logo_Maestro.png,"EVM,Sniper",fav_Maestro.png,,2025-06-22T15:31:33.142Z,Referral link available
TG Trading Bots,Bonkbot,https://t.me/bonkbot_bot,https://t.me/bonkbot_bot?start=ref_iht7j,,Existing,"BonkBot is a leading Telegram trading bot built specifically for the Solana blockchain, known for its extreme speed in executing token swaps. It gained popularity through its association with the Bonk (BONK) memecoin, offering rapid transaction capabilities for Solana tokens.","Solana trading bot,Extremely fast execution,Telegram interface,Token swapping,Memecoin focus.",logo_Bonkbot.png,"Solana,Memecoins",fav_Bonkbot.png,,2025-06-22T15:31:33.643Z,Referral link available
TG Trading Bots,fluxbot,https://fluxbot.xyz/,https://t.me/fluxbeam_bot?start=DextrorsaL,,Existing,"Fluxbot is a Telegram trading bot designed for high-speed and efficient token swaps on the Solana blockchain. It offers advanced features and AI assistant for executing trades quickly, managing positions, and interacting with Solana-based decentralized exchanges.","Solana trading bot,High-speed execution,Telegram interface,Token swapping,Position management.",logo_fluxbot.png,"Solana,High-speed,AI",fav_fluxbot.png,,2025-06-22T15:31:34.159Z,Referral link available
TG Trading Bots,banana gun bot,https://t.me/BananaGunBot,https://t.me/BananaGun_bot?start=ref_D3X7,,Existing,"Banana Gun Bot is a well-known Telegram trading bot focused on highly efficient and fast token snipes and swaps on Solana and Ethereum. It provides advanced features for participating in new token launches, anti-rug measures, and secure trading directly through Telegram.","Ethereumand Solana  trading bot,Fast token snipes,New launch participation,Anti-rug protection,Secure trading.",logo_banana_gun_bot.png,"Anti-rug,Sniper",fav_banana_gun_bot.png,,2025-06-22T15:31:34.659Z,Referral link available
TG Trading Bots,gmgn,https://t.me/gmgnai_bot,https://t.me/gmgnaibot?start=i_c0chR98s,,Existing,,,,,,,2025-06-22T15:31:35.159Z,Referral link available
TG Trading Bots,bullxneo,https://t.me/bullxneobot,https://t.me/BullXNeoBot?start=access_Z7EJ8X3UOB,,Existing,,,,,,,2025-06-22T15:31:35.660Z,Referral link available
TG Trading Bots,cielo,https://t.me/cielo_finance_bot,,,Existing,"Cielo Finance Bot is a Telegram-based platform that provides real-time transaction notifications and analytical insights across various blockchains. It aims to offer comprehensive on-chain data tracking, wallet monitoring, and custom alerts for decentralized finance activities.","Real-time TX alerts,On-chain data tracking,Wallet monitoring,Custom notifications,DeFi insights.",logo_cielo.png,"Analytics,Wallet Tracking,Alerts",fav_cielo.png,,2025-06-22T15:31:36.168Z,Check platform for offers
TG Trading Bots,magnum trading bot,https://t.me/magnum_trade_bot,https://t.me/magnum_trade_bot?start=DNJkrOrl,,Existing,"Magnum Trading Bot is a Multi-chainTelegram-based tool designed for rapid, secure, and user-friendly cryptocurrency trading, particularly for new token launches. It offers fast token swaps, robust anti-rug mechanisms, sophisticated sniping tools, and liquidity management, aiming to optimize trading operations directly through the messaging app.","Telegram trading bot,Fast token swaps,Anti-rug protection,Sophisticated sniping tools,User-friendly interface.",logo_magnum_trading_bot.png,"Sniper,Mult-chain",,,2025-06-22T15:31:36.670Z,Referral link available
TG Trading Bots,pumppill,https://t.me/pumppill_bot,https://t.me/pump_fun_bot?start=r_6385385407,,Existing,"Pump Pill Bot is a Telegram-based bot specializing in automated, high-risk trading for new token launches, particularly within the memecoin space. It offers specific advanced features like auto-sniping new token liquidity and automated selling based on developer activity, catering to users looking for highly speculative gains.","Telegram trading bot,Auto-snipe new tokens,Automated dev sell,High-risk trading,Memecoin focus.",logo_pumppill.png,"Sniper,Auto dev sell",fav_pumppill.png,,2025-06-22T15:31:37.178Z,Referral link available
TG Trading Bots,Unibot v2,,https://t.me/unibotsniper_bot?start=d3x7,,,"Unibot (V2 / Sniper) is a highly advanced, multi-chain Telegram trading bot. It offers ultra-fast token swaps, sophisticated sniping capabilities for new launches, and a comprehensive suite of trading tools including Dollar-Cost Averaging (DCA), cross-chain bridging, limit orders, copy trading, and automated grid trading strategies, catering to professional and active retail traders.","Multi-chain trading,Ultra-fast swaps,DCA/Grid trading,Cross-chain bridging,Advanced sniping.",logo_Unibot_v2.png,"Multi-chain,Automation",fav_Unibot_v2.png,,2025-06-22T15:31:37.686Z,Referral link available
TG Trading Bots,KekBot,,https://t.me/realKekBot?start=BwtrJBIpJ,,,"KekBot is a Telegram bot primarily associated with memecoin trading and community engagement, often within the Base blockchain ecosystem. It offers tools for rapid token swaps, sniping new launches, and managing positions on Solana and Ethereum.","Memecoin trading,Telegram bot,Solana and Ethereum chain,Rapid token swaps,Community tools.",logo_KekBot.png,"Memecoins,Solana,Ethereum",fav_KekBot.png,,2025-06-22T15:31:38.202Z,Referral link available
TG Trading Bots,PepeBoost,,https://t.me/pepeboost_sol11_bot?start=ref_0hy9rl,,,"PepeBoost is a fast, multi-chain Telegram trading bot specializing in automated execution for new token launches and rapid token swaps, particularly within the memecoin space. It offers advanced features like quick sniping, anti-front-running protection, one-click copy trading, and comprehensive multi-wallet management.","Multi-chain trading bot,Fast sniping execution,Anti-front-running,One-click copy trading,Multi-wallet management.",logo_PepeBoost.png,"Multi-chain,Sniping",fav_PepeBoost.png,,2025-06-22T15:31:38.703Z,Referral link available
TG Trading Bots,,,,,,,,,,,,2025-06-22T15:31:39.203Z,Check platform for offers
Staking,Stakecity,https://stakecity.com,,,Existing,,,,,,,2025-06-22T15:31:39.717Z,Check platform for offers
Staking,Jito,https://www.jito.network,,,Existing,"Jito is a liquid staking protocol and critical infrastructure provider on Solana, now actively focused on enabling restaking and optimizing MEV (Maximal Extractable Value) capture for stakers. It supports Node Consensus Networks (NCNs) where node operators manage infrastructure, choosing to secure multiple networks and vaults through restaking to enhance overall network efficiency and decentralization.","Solana liquid staking,MEV optimization,Restaking infrastructure,Node Consensus Networks,Node operator support.",logo_Jito.png,"Solana,MEV,Restaking",fav_Jito.png,,2025-06-22T15:31:40.221Z,Check platform for offers
Staking,Pyth,https://pyth.network,,,Existing,"Pyth Network is a leading decentralized oracle network that provides high-fidelity, high-frequency market data to various blockchains. It sources data directly from first-party financial institutions and exchanges, aiming to power secure and reliable DeFi applications.","Decentralized oracle,High-fidelity data,High-frequency updates,First-party sources,Cross-chain data.",logo_Pyth.png,"Oracle,Analytics",fav_Pyth.png,,2025-06-22T15:31:40.722Z,Check platform for offers
